Checkmate SLR 7 AXS,,publish,product,58668,7499.0,Gravel bikes,Trek,https://www.trekbikes.com/nl/nl_NL/p/58668/,greendark_greenlight,Green dark/Green light,800 Series Oclv Carbon,Endurance*,,125 kg,SRAM Force AXS,"1x, geen voorderailleur","SRAM Force XPLR AXS, max. tandwielgrootte 46T","Maat: XS, S SRAM Force XPLR met AXS vermogensmeter, 42T, DUB Wide, lengte 165 mm","SRAM DUB Wide, T47 met schroefdraad, interne lagers","SRAM Force XPLR XG-1371, 10-46, 13-speed","SRAM Force E1, 12/13-speed",,Bekijk de servicehandleiding,,"Bontrager Switch afgeschuinde steekas, afneembare hendel",,,"Bontrager Girona RSL, Tubeless Ready, GR-lekbescherming, aramide hieldraad, 220 tpi, 700 x 42 mm","45 mm zonder spatborden, 38 mm met spatborden (feitelijk gemeten, bekijk de handleiding voor details)",,"KVF aero carbon zadelpen, 5 mm offset, 280 mm lengte",,Trek EcoTack,,,,13-speed,"Checkmate SLR full carbon, taps toelopende carbon stuurbuis, weggewerkte spatbordbevestigingen, flat-mount schijfrem, 12 x 100 mm steekas","Bontrager Switch afgeschuinde steekas, afneembare hendel",,"SRAM Paceline X, afgerond, centerlock, 160 mm",Maximale maten remschijf: 180 mm vooraan en achteraan,"Bontrager TLR-dichtmiddel, 175 ml",,,,,"Bontrager Aeolus Pro 3V, OCLV Carbon, Tubeless Ready, 25 mm velgbreedte, 100 x 12 mm steekas","Bontrager Aeolus Pro 3V, OCLV Carbon, Tubeless Ready, 25 mm velgbreedte, SRAM XD-R freewheelbody, 142 x 12 mm steekas",,SRAM eTap accu (met lader),,,,"Maat: XS Trek Aero RSL geïntegreerde stuur/stuurpen, OCLV Carbon, race-geometrie, 80 mm reach, 124 mm drop, 37 cm breedte bij hendels, drop-breedte 40 cm, stuurpenlengte 70 mm",,,,,,,"https://media.trekbikes.com/image/upload/c_pad,w_1360,h_1020,f_jpg,fl_progressive:semi,q_auto,fl_strip_profile/CheckmateSLR9AXS-26-46152-C-Primary",images/Trek/Checkmate_SLR_7_AXS/CheckmateSLR9AXS-26-46152-C-Primary_01.jpg,"https://media.trekbikes.com/image/upload/c_pad,w_1360,h_1020,f_jpg,fl_progressive:semi,q_auto,fl_strip_profile/CheckmateSLRFrameset-26-46763-A-Primary",images/Trek/Checkmate_SLR_7_AXS/CheckmateSLRFrameset-26-46763-A-Primary_02.jpg,"https://media.trekbikes.com/image/upload/c_pad,w_1360,h_1020,f_jpg,fl_progressive:semi,q_auto,fl_strip_profile/CheckmateSLR7AXS-25-46692-C-Primary",images/Trek/Checkmate_SLR_7_AXS/CheckmateSLR7AXS-25-46692-C-Primary_03.jpg,"https://media.trekbikes.com/image/upload/c_pad,w_1360,h_1020,f_jpg,fl_progressive:semi,q_auto,fl_strip_profile/CheckmateSLR8AXS-25-49169-A-Primary",images/Trek/Checkmate_SLR_7_AXS/CheckmateSLR8AXS-25-49169-A-Primary_04.jpg,"https://media.trekbikes.com/image/upload/c_pad,w_1360,h_1020,f_jpg,fl_progressive:semi,q_auto,fl_strip_profile/CheckmateSLR9AXS-26-46152-B-Primary",images/Trek/Checkmate_SLR_7_AXS/CheckmateSLR9AXS-26-46152-B-Primary_05.jpg,2025-07-18 09:56:56,trek_scraper
Madone SL 7 Gen 7,,publish,product,41467,7999.0,Performance road bikes,Trek,https://www.trekbikes.com/nl/nl_NL/p/41467/,greylight,Grey light,500 Series Oclv Carbon,H1.5 Race*,"56 cm - 8,00 kg",125 kg,Shimano Ultegra R8170 Di2,"Shimano Ultegra R8150 Di2, aanlasnok, down swing","Shimano Ultegra R8150 Di2, max. tandwielgrootte 34T","Maat: 47 Shimano Ultegra R8100, 52/36, 165 mm lengte","Praxis, T47 met schroefdraad, interne lagers","Shimano Ultegra R8100, 11-30, 12-speed","Shimano XT M8100, 12-speed",,"1x: 50T, 2x: 54/40",,"Bontrager Switch steekas, afneembare hendel",,"Bontrager Aeolus Pro 51, OCLV Carbon, Tubeless Ready","Bontrager R3 Hard-Case Lite, aramide hieldraad, 120 tpi, 700 x 25 mm","32 mm (feitelijk gemeten, bekijk de handleiding voor details)","Maat: 47, 50, 52 Bontrager Aeolus Comp, stalen rails, 155 mm breedte","Maat: 47, 50, 52, 54 Madone aero carbon zadelpen, 0 mm offset, korte versie","Maat: 47 Bontrager RSL Aero, OCLV Carbon, 31,8 mm, interne Di2-kabelgeleiding, 80 mm reach, 124 mm drop, 35 cm breedte bij hendels, 38 cm breedte onderin stuurbeugel",Bontrager Supertack geperforeerd stuurlint,"Maat: 47 Trek RCS Pro, -7 graden, 70 mm lengte",,"Shimano Ultegra hydraulische schijfrem, flat-mount",12-speed,"Madone KVF full carbon, taps toelopende carbon stuurbuis, interne remkabelgeleiding, flat-mount schijfrembevestiging, carbon dropouts, 12 x 100 mm steekas","Bontrager Switch steekas, afneembare hendel",,"Shimano CL800, centerlock, 160 mm",Maximale maat remschijven: 160 mm voor en achter,,,,,,"Bontrager Aeolus Pro 51, OCLV Carbon, Tubeless Ready, 100 x 12 mm steekas","Bontrager Aeolus Pro 51, OCLV carbon, Tubeless Ready, Shimano 11/12-speed freewheelbody, 142 x 12 mm steekas",,Shimano BT-DN300,Inclusief laadkabel,,,,,,,,,,"https://media.trekbikes.com/image/upload/c_pad,w_1360,h_1020,f_jpg,fl_progressive:semi,q_auto,fl_strip_profile/MadoneSL7-25-46220-A-Primary",images/Trek/Madone_SL_7_Gen_7/MadoneSL7-25-46220-A-Primary_01.jpg,"https://media.trekbikes.com/image/upload/c_pad,w_1360,h_1020,f_jpg,fl_progressive:semi,q_auto,fl_strip_profile/MadoneSL6AXS-25-46221-A-Primary",images/Trek/Madone_SL_7_Gen_7/MadoneSL6AXS-25-46221-A-Primary_02.jpg,"https://media.trekbikes.com/image/upload/c_pad,w_1360,h_1020,f_jpg,fl_progressive:semi,q_auto,fl_strip_profile/MadoneSL5-25-46218-A-Primary",images/Trek/Madone_SL_7_Gen_7/MadoneSL5-25-46218-A-Primary_03.jpg,"https://media.trekbikes.com/image/upload/c_pad,w_1360,h_1020,f_jpg,fl_progressive:semi,q_auto,fl_strip_profile/MadoneSL6-25-46219-C-Primary",images/Trek/Madone_SL_7_Gen_7/MadoneSL6-25-46219-C-Primary_04.jpg,"https://media.trekbikes.com/image/upload/c_pad,w_1360,h_1020,f_jpg,fl_progressive:semi,q_auto,fl_strip_profile/MadoneSL6-24-41466-A-Primary",images/Trek/Madone_SL_7_Gen_7/MadoneSL6-24-41466-A-Primary_05.jpg,2025-07-18 09:56:56,trek_scraper
Domane SLR 7 AXS Gen 4,,publish,product,57915,7999.0,Performance road bikes,Trek,https://www.trekbikes.com/nl/nl_NL/p/57915/,green,Green,800 Series Oclv Carbon,Endurance*,,125 kg,SRAM Force AXS,"SRAM Force AXS, aanlasnok","SRAM Force AXS, max. tandwielgrootte 36T","Maat: 47, 50 SRAM Force AXS met vermogensmeter, 46/33, DUB, lengte 165 mm","SRAM DUB, T47 met schroefdraad, interne lagers","SRAM Force XG-1270, 10-36, 12-speed","SRAM Force E1, 12/13-speed",,"1x: 48T, 2x: 52/36",,"Bontrager Switch steekas, afneembare hendel",,"Bontrager Aeolus Pro 51, OCLV Carbon, Tubeless Ready","Bontrager Kwaremont Pro GR, Tubeless Ready, vouwband, Dual Compound, 320 tpi, 700x32 mm","38 mm zonder spatborden, 35 mm met spatborden (feitelijk gemeten, bekijk de handleiding voor details)","Verse Short Pro, carbon rails, 145 mm breedte","Maat: 47, 50, 52, 54, 56 KVF aero carbon zadelpen, 20 mm offset, 280 mm lengte","Maat: 47 Bontrager Aero Pro, OCLV Carbon, 31,8 mm, interne Di2-kabelgeleiding, stuurdiepte 80 mm, stuurval 124 mm, breedte 38 cm",Trek EcoTack,"Maat: 47 Trek RCS Pro, -7 graden, 70 mm lengte",,,12-speed,"Domane SLR carbon, taps toelopende carbon stuurbuis, interne remkabelgeleiding, spatbordbevestigingen, Flat-Mount schijfrem, carbon dropouts, 12 x 100 mm steekas","Bontrager Switch steekas, afneembare hendel",,"SRAM Paceline X, afgerond, centerlock, 160 mm",Maximale maat remschijven: 160 mm voor en achter,"Bontrager TLR-dichtmiddel, 175 ml",,,,,"Bontrager Aeolus Pro 51, OCLV Carbon, Tubeless Ready, 100 x 12 mm steekas","Bontrager Aeolus Pro 51, OCLV carbon, Tubeless Ready, Shimano 11/12-speed freewheelbody, 142 x 12 mm steekas",,SRAM eTap accu (met lader),,,,,,,,,,,"https://media.trekbikes.com/image/upload/c_pad,w_1360,h_1020,f_jpg,fl_progressive:semi,q_auto,fl_strip_profile/DomaneSLR9AXS-26-57944-B-Primary",images/Trek/Domane_SLR_7_AXS_Gen_4/DomaneSLR9AXS-26-57944-B-Primary_01.jpg,"https://media.trekbikes.com/image/upload/c_pad,w_1360,h_1020,f_jpg,fl_progressive:semi,q_auto,fl_strip_profile/DomaneSLR9-26-57942-A-Primary",images/Trek/Domane_SLR_7_AXS_Gen_4/DomaneSLR9-26-57942-A-Primary_02.jpg,"https://media.trekbikes.com/image/upload/c_pad,w_1360,h_1020,f_jpg,fl_progressive:semi,q_auto,fl_strip_profile/DomaneSLR7-26-57892-C-Primary",images/Trek/Domane_SLR_7_AXS_Gen_4/DomaneSLR7-26-57892-C-Primary_03.jpg,"https://media.trekbikes.com/image/upload/c_pad,w_1360,h_1020,f_jpg,fl_progressive:semi,q_auto,fl_strip_profile/DomaneSLRFrameset_23_37303_A_Primary",images/Trek/Domane_SLR_7_AXS_Gen_4/DomaneSLRFrameset_23_37303_A_Primary_04.jpg,"https://media.trekbikes.com/image/upload/c_pad,w_1360,h_1020,f_jpg,fl_progressive:semi,q_auto,fl_strip_profile/DomaneRSLDiscFrameset-24-44314-A-Primary",images/Trek/Domane_SLR_7_AXS_Gen_4/DomaneRSLDiscFrameset-24-44314-A-Primary_05.jpg,2025-07-18 09:56:56,trek_scraper
Madone SLR 7 Gen 8,,publish,product,46687,7999.0,Performance road bikes,Trek,https://www.trekbikes.com/nl/nl_NL/p/46687/,red,Red,900 Series Oclv Carbon,H1.5 Race*,"ML- 7,31 kg (met TLR-dichtmiddel, zonder binnenbanden, zonder bidons/bidonhouders)",125 kg,Shimano Ultegra R8170 Di2,"Shimano Ultegra R8150 Di2, aanlasnok, down swing","Shimano Ultegra R8150 Di2, max. tandwielgrootte 34T","Maat: XS, S Shimano Ultegra R8100, 52/36, 165 mm lengte","Praxis, T47 met schroefdraad, interne lagers","Shimano Ultegra R8101, 11-30, 12-speed","Shimano Ultegra/XT M8100, 12-speed",,"1x: 54T, 2x: 56/43",,"Bontrager Switch afgeschuinde steekas, afneembare hendel",,"Bontrager Aeolus Pro 51, OCLV Carbon, Tubeless Ready","Maat: XS, S, M, ML, L, XL Pirelli P Zero Race, 120 tpi, geschikt voor tubeless, 700 x 28 mm","32 mm (feitelijk gemeten, bekijk de handleiding voor details)","Maat: XS, S Bontrager Aeolus P2 Pro, carbon rails, 155 mm breedte","Madone aero carbon zadelpen, 0 mm offset, korte versie",,Trek EcoTack,,,,12-speed,"Madone Gen 8 uit één stuk carbon, taps toelopende carbon stuurbuis, interne remkabelgeleiding, flat-mount schijfrembevestiging, 12 x 100 mm afgeschuinde steekas","Bontrager Switch afgeschuinde steekas, afneembare hendel",,"Shimano CL800, centerlock, 160 mm","Maximale maat remschijven: 180 mm voor, 160 mm achter","Bontrager TLR-dichtmiddel, 175 ml",,"900 Series OCLV Carbon, Full System Foil buisvormen, IsoFlow zitbuis, RCS balhoofdsysteem, kabelgeleiding alleen voor elektronisch schakelen, afneembare aero chainkeeper, T47 BB, flat-mount schijfrembevestiging, UDH, 142x12 mm steekas",,,"Bontrager Aeolus Pro 51, OCLV Carbon, Tubeless Ready, 100 x 12 mm steekas","Bontrager Aeolus Pro 51, OCLV carbon, Tubeless Ready, Shimano 11/12-speed freewheelbody, 142 x 12 mm steekas",,Shimano BT-DN300,Inclusief laadkabel,,,"Maat: XS Trek Aero RSL geïntegreerde stuur/stuurpen, OCLV Carbon, race-geometrie, 80 mm reach, 124 mm drop, 35 cm breedte bij hendels, drop-breedte 38 cm, stuurpenlengte 80 mm","Pirelli P Zero SmarTube, TPU",,,,,,"https://media.trekbikes.com/image/upload/c_pad,w_1360,h_1020,f_jpg,fl_progressive:semi,q_auto,fl_strip_profile/MadoneSLR9AXS-25-46151-D-Primary",images/Trek/Madone_SLR_7_Gen_8/MadoneSLR9AXS-25-46151-D-Primary_01.jpg,"https://media.trekbikes.com/image/upload/c_pad,w_1360,h_1020,f_jpg,fl_progressive:semi,q_auto,fl_strip_profile/MadoneSLR9-25-46707-A-Primary",images/Trek/Madone_SLR_7_Gen_8/MadoneSLR9-25-46707-A-Primary_02.jpg,"https://media.trekbikes.com/image/upload/c_pad,w_1360,h_1020,f_jpg,fl_progressive:semi,q_auto,fl_strip_profile/MadoneSLR7AXS-25-46688-A-Primary",images/Trek/Madone_SLR_7_Gen_8/MadoneSLR7AXS-25-46688-A-Primary_03.jpg,"https://media.trekbikes.com/image/upload/c_pad,w_1360,h_1020,f_jpg,fl_progressive:semi,q_auto,fl_strip_profile/MadoneSLR8AXSRed-25-49168-C-Primary",images/Trek/Madone_SLR_7_Gen_8/MadoneSLR8AXSRed-25-49168-C-Primary_04.jpg,"https://media.trekbikes.com/image/upload/c_pad,w_1360,h_1020,f_jpg,fl_progressive:semi,q_auto,fl_strip_profile/MadoneSLR7AXS-26-58135-A-Primary",images/Trek/Madone_SLR_7_Gen_8/MadoneSLR7AXS-26-58135-A-Primary_05.jpg,2025-07-18 09:56:56,trek_scraper
Madone SLR 7 AXS,,publish,product,58135,8499.0,Performance road bikes,Trek,https://www.trekbikes.com/nl/nl_NL/p/58135/,blue,Blue,900 Series Oclv Carbon,H1.5 Race*,,125 kg,SRAM Force AXS,"SRAM Force AXS, aanlasnok","SRAM Force AXS, max. tandwielgrootte 36T","Maat: XS, S SRAM Force AXS met vermogensmeter, 48/35, DUB, lengte 165 mm","SRAM DUB, T47 met schroefdraad, interne lagers","SRAM Force XG-1270, 10-33, 12-speed","SRAM Force E1, 12/13-speed",,"1x: 54T, 2x: 56/43",,"Bontrager Switch afgeschuinde steekas, afneembare hendel",,,"Maat: XS, S, M, ML, L, XL Bontrager Aeolus RSL RD, Tubeless Ready, gemaakt van katoen, aramide hieldraad, 170 tpi, 700x28 mm","32 mm (feitelijk gemeten, bekijk de handleiding voor details)","Bontrager Aeolus Pro, carbon rails, 145 mm breedte","Madone aero carbon zadelpen, 0 mm offset, korte versie",,Trek EcoTack,,,"SRAM Force AXS hydraulic disc, flat mount",12-speed,"Madone Gen 8 uit één stuk carbon, taps toelopende carbon stuurbuis, interne remkabelgeleiding, flat-mount schijfrembevestiging, 12 x 100 mm afgeschuinde steekas","Maat: XS, S, M, ML, L, XL Bontrager Switch afgeschuinde steekas, afneembare hendel",,"Maat: XS, S, XL SRAM Paceline X, afgerond, centerlock, 160 mm","Maximale maat remschijven: 180 mm voor, 160 mm achter",,,"900 Series OCLV Carbon, Full System Foil buisvormen, IsoFlow zitbuis, RCS balhoofdsysteem, kabelgeleiding alleen voor elektronisch schakelen, afneembare aero chainkeeper, T47 BB, flat-mount schijfrembevestiging, UDH, 142x12 mm steekas",,,"Bontrager Aeolus Pro 51, OCLV Carbon, Tubeless Ready, 100 x 12 mm steekas","Bontrager Aeolus Pro 51, OCLV Carbon, Tubeless Ready, SRAM XD-R body, 142 x 12 mm steekas",,SRAM eTap accu (met lader),,,,"Maat: XS Trek Aero RSL geïntegreerde stuur/stuurpen, OCLV Carbon, race-geometrie, 80 mm reach, 124 mm drop, 35 cm breedte bij hendels, drop-breedte 38 cm, stuurpenlengte 80 mm","Pirelli P Zero SmarTube, TPU",,,,,,"https://media.trekbikes.com/image/upload/c_pad,w_1360,h_1020,f_jpg,fl_progressive:semi,q_auto,fl_strip_profile/MadoneSLR9AXS-25-46151-D-Primary",images/Trek/Madone_SLR_7_AXS/MadoneSLR9AXS-25-46151-D-Primary_01.jpg,"https://media.trekbikes.com/image/upload/c_pad,w_1360,h_1020,f_jpg,fl_progressive:semi,q_auto,fl_strip_profile/MadoneSLR9-25-46707-A-Primary",images/Trek/Madone_SLR_7_AXS/MadoneSLR9-25-46707-A-Primary_02.jpg,"https://media.trekbikes.com/image/upload/c_pad,w_1360,h_1020,f_jpg,fl_progressive:semi,q_auto,fl_strip_profile/MadoneSLR7-25-46687-B-Primary",images/Trek/Madone_SLR_7_AXS/MadoneSLR7-25-46687-B-Primary_03.jpg,"https://media.trekbikes.com/image/upload/c_pad,w_1360,h_1020,f_jpg,fl_progressive:semi,q_auto,fl_strip_profile/MadoneSLR7AXS-25-46688-A-Primary",images/Trek/Madone_SLR_7_AXS/MadoneSLR7AXS-25-46688-A-Primary_04.jpg,"https://media.trekbikes.com/image/upload/c_pad,w_1360,h_1020,f_jpg,fl_progressive:semi,q_auto,fl_strip_profile/MadoneSLR8AXSRed-25-49168-C-Primary",images/Trek/Madone_SLR_7_AXS/MadoneSLR8AXSRed-25-49168-C-Primary_05.jpg,2025-07-18 09:56:56,trek_scraper
Speed Concept SLR 7,,publish,product,35577,8499.0,Triathlon bikes,Trek,https://www.trekbikes.com/nl/nl_NL/p/35577/,reddark_black,Red dark/Black,800 Series OCLV-carbon,Triatlon,"M - 8,97 kg",125 kg,"Shimano Dura-Ace hydraulische schijfrem, R9180 Di2 hendel, R9270 remklauw, 160 mm remschijf","Shimano Ultegra R8150 Di2, aanlasnok, down swing","Shimano Ultegra R8150 Di2, max. tandwielgrootte 34T","Maat: S, M, L Shimano Ultegra R8100, 52/36, 170 mm lengte","Praxis, T47 met schroefdraad, interne lagers","Shimano Ultegra R8101, 11-30, 12-speed","Shimano Ultegra/XT M8100, 12-speed",,"1x: 58T, 2x: 55/44",,"Bontrager Switch steekas, afneembare hendel",,"Bontrager Aeolus Pro 51, OCLV Carbon, Tubeless Ready","Maat: S, M, L, XL Bontrager R3 Hard-Case Lite, aramide hieldraad, 120 tpi, 700 x 25 mm","28mm achter, 25mm voor","Maat: S, M, L, XL Bontrager Hilo Comp, holle chromoly rails","Maat: S Speed Concept SLR, 11,5 mm of -20 mm offset, korte versie",,"Maat: S, M, L, XL Bontrager Supertack geperforeerd stuurlint",,,"Shimano Dura-Ace hydraulische schijfrem, flat-mount",11-speed,"SC full foil carbon, geïntegreerde rem &amp; stuurpen","Bontrager Switch steekas, afneembare hendel",,"Shimano CL800, centerlock, 160 mm",Maximale maat remschijven: 160 mm voor en achter,,,,,,"Bontrager Aeolus Pro 51, OCLV Carbon, Tubeless Ready, 100 x 12 mm steekas","Bontrager Aeolus Pro 51, OCLV carbon, Tubeless Ready, Shimano 11/12-speed freewheelbody, 142 x 12 mm steekas",,Shimano BT-DN300,Inclusief laadkabel,,,Speed Concept mid-rise bar/stem,,"Maat: S, M Speed Concept 30 mm basissteun",Speed Concept Downtube Bottle Cage,Speed Concept bidon op de onderbuis,,,"https://media.trekbikes.com/image/upload/c_pad,w_1360,h_1020,f_jpg,fl_progressive:semi,q_auto,fl_strip_profile/SpeedConceptSLR9AXS-25-48020-E-Primary",images/Trek/Speed_Concept_SLR_7/SpeedConceptSLR9AXS-25-48020-E-Primary_01.jpg,"https://media.trekbikes.com/image/upload/c_pad,w_1360,h_1020,f_jpg,fl_progressive:semi,q_auto,fl_strip_profile/SpeedConceptSLR7AXS-26-56332-E-Primary",images/Trek/Speed_Concept_SLR_7/SpeedConceptSLR7AXS-26-56332-E-Primary_02.jpg,"https://media.trekbikes.com/image/upload/c_pad,w_1360,h_1020,f_jpg,fl_progressive:semi,q_auto,fl_strip_profile/SpeedConceptSLR9-26-35757-A-Primary",images/Trek/Speed_Concept_SLR_7/SpeedConceptSLR9-26-35757-A-Primary_03.jpg,"https://media.trekbikes.com/image/upload/c_pad,w_1360,h_1020,f_jpg,fl_progressive:semi,q_auto,fl_strip_profile/SpeedConceptTTFrameset_22_35746_A_Primary",images/Trek/Speed_Concept_SLR_7/SpeedConceptTTFrameset_22_35746_A_Primary_04.jpg,"https://media.trekbikes.com/image/upload/c_pad,w_1360,h_1020,f_jpg,fl_progressive:semi,q_auto,fl_strip_profile/SpeedConceptSLRFrameset_22_35671_A_Primary",images/Trek/Speed_Concept_SLR_7/SpeedConceptSLRFrameset_22_35671_A_Primary_05.jpg,2025-07-18 09:56:56,trek_scraper
Domane+ SLR 6 Pro,,publish,product,36703,8499.0,Electric road bikes,Trek,https://www.trekbikes.com/nl/nl_NL/p/36703/,black_grey,Black/Grey,800 Series Oclv Carbon,Endurance,"56 cm - 12.49 kg (met TLR sealant, zonder binnenbanden)",125 kg,Shimano 105 R7170,"Shimano 105 R7150 Di2, aanlasnok, down-swing","Shimano 105 R7150 Di2, max. tandwielgrootte 36T","Maat: 50, 52 Praxis Carbon, 170 mm lengte","Praxis, T47 met schroefdraad, interne lagers*","Maat: 50, 52, 54, 56, 58, 60, 62 Shimano 105 7100, 11-34, 12-speed","Shimano SLX M7100, 12-speed",,"1x: 46T, 2x: 52/36",,"Bontrager Switch steekas, afneembare hendel",,,"Bontrager R3 Hard-Case Lite, Tubeless Ready, aramide hieldraad, 120 tpi, 700 x 32 mm","40mm zonder spatborden, 35mm met spatborden","Maat: 50, 52 Bontrager Verse Short Elite, holle roestvaststalen rails, 155 mm breedte","Maat: 50, 52, 54, 56 KVF aero carbon zadelpen, 20 mm offset, 280 mm lengte","Maat: 50, 52 Bontrager Pro IsoCore VR-SF, 40 cm",Bontrager Supertack geperforeerd stuurlint,"Maat: 50 Trek RCS Pro, -7 graden, 80 mm lengte",,"Shimano 105 hydraulic disc, BR-R7170 flat mount caliper, resin pad w/fin",12-speed,"Domane+ carbon, taps toelopende carbon stuurbuis, interne remkabelgeleiding, bevestigingspunten voor spatborden, flat-mount schijfrembevestiging, 12 x 100 mm steekas","Bontrager Switch steekas, afneembare hendel",,"Shimano RT70, centerlock, 160 mm","Maximale maten remschijf: 180mm voor, 160mm achter","Bontrager TLR-dichtmiddel, 175 ml",Bontrager TLR,,,,"Bontrager Aeolus Pro 37, OCLV Carbon, Tubeless Ready, 37 mm velghoogte, 100 x 12 mm steekas","Bontrager Aeolus Pro 37, OCLV Carbon, Tubeless Ready, 37 mm velghoogte, Shimano 11-speed freewheelnaaf, 142 x 12 mm steekas",,"Maat: 50, 52, 54, 56, 58, 60, 62 TQ 360 Wh","Maat: 50, 52, 54, 56, 58, 60, 62 TQ 4A lader","TQ-HPR50, 50 Nm koppel, 250 watt maximaal continu vermogen, 300 watt piekvermogen",,,,,,,TQ led-display met Bluetooth &amp; ANT+ verbindingsmogelijkheden,,"https://media.trekbikes.com/image/upload/c_pad,w_1360,h_1020,f_jpg,fl_progressive:semi,q_auto,fl_strip_profile/DomanePlusSLR9-25-36742-B-primary",images/Trek/Domane_SLR_6_Pro/DomanePlusSLR9-25-36742-B-primary_01.jpg,"https://media.trekbikes.com/image/upload/c_pad,w_1360,h_1020,f_jpg,fl_progressive:semi,q_auto,fl_strip_profile/DomanePlusSLR7eTapUS-24-41482-C-Primary",images/Trek/Domane_SLR_6_Pro/DomanePlusSLR7eTapUS-24-41482-C-Primary_02.jpg,"https://media.trekbikes.com/image/upload/c_pad,w_1360,h_1020,f_jpg,fl_progressive:semi,q_auto,fl_strip_profile/DomanePlusSLR7_23_36711_C_Primary",images/Trek/Domane_SLR_6_Pro/DomanePlusSLR7_23_36711_C_Primary_03.jpg,"https://media.trekbikes.com/image/upload/c_pad,w_1360,h_1020,f_jpg,fl_progressive:semi,q_auto,fl_strip_profile/DOMANEPLUSSLR8AXSUS-25-49165-B-Primary",images/Trek/Domane_SLR_6_Pro/DOMANEPLUSSLR8AXSUS-25-49165-B-Primary_04.jpg,"https://media.trekbikes.com/image/upload/c_pad,w_1360,h_1020,f_jpg,fl_progressive:semi,q_auto,fl_strip_profile/DomanePlusSLR9_23_36742_C_Primary",images/Trek/Domane_SLR_6_Pro/DomanePlusSLR9_23_36742_C_Primary_05.jpg,2025-07-18 09:56:56,trek_scraper
Domane+ SLR 7,,publish,product,36707,8499.0,Electric road bikes,Trek,https://www.trekbikes.com/nl/nl_NL/p/36707/,white_gold,White/Gold,800 Series Oclv Carbon,Endurance,"56 cm - 12.59 kg (met TLR sealant, zonder binnenbanden)",125 kg,Shimano Ultegra R8170 Di2,"Shimano Ultegra R8150 Di2, aanlasnok, down swing","Shimano Ultegra R8150 Di2, max. tandwielgrootte 34T","Maat: 50, 52 Praxis Carbon, 170 mm lengte","Praxis, T47 met schroefdraad, interne lagers*","Shimano Ultegra R8101, 11-34, 12-speed","Maat: 50, 52, 54, 56, 58, 60, 62 Shimano XT M8100, 12-speed",,"1x: 46T, 2x: 52/36",,"Bontrager Switch steekas, afneembare hendel",,,"Bontrager R3 Hard-Case Lite, Tubeless Ready, aramide hieldraad, 120 tpi, 700 x 32 mm","40mm zonder spatborden, 35mm met spatborden","Maat: 50, 52 Verse Short Elite, holle roestvaststalen rails, 155 mm breedte","Maat: 50, 52, 54, 56 KVF aero carbon zadelpen, 20 mm offset, 280 mm lengte","Maat: 50, 52 Bontrager Pro IsoCore VR-SF, 40 cm",Bontrager Supertack geperforeerd stuurlint,"Maat: 50 Trek RCS Pro, -7 graden, 80 mm lengte",,"Shimano Ultegra hydraulic disc, BR-R8170 flat mount caliper, resin pad w/fin",12-speed,"Domane+ carbon, taps toelopende carbon stuurbuis, interne remkabelgeleiding, bevestigingspunten voor spatborden, flat-mount schijfrembevestiging, 12 x 100 mm steekas","Bontrager Switch steekas, afneembare hendel",,"Maat: 50, 52, 54, 56, 58, 60, 62 Shimano MT800, centerlock, 160 mm","Maximale maten remschijf: 180mm voor, 160mm achter","Bontrager TLR-dichtmiddel, 175 ml",Bontrager TLR,,,,"Bontrager Aeolus Pro 37, OCLV Carbon, Tubeless Ready, 37 mm velghoogte, 100 x 12 mm steekas","Bontrager Aeolus Pro 37, OCLV Carbon, Tubeless Ready, 37 mm velghoogte, Shimano 11-speed freewheelnaaf, 142 x 12 mm steekas",,"Maat: 50, 52, 54, 56, 58, 60, 62 TQ 360 Wh","Maat: 50, 52, 54, 56, 58, 60, 62 TQ 4A lader","TQ-HPR50, 50 Nm koppel, 250 watt maximaal continu vermogen, 300 watt piekvermogen",,,,,,,TQ led-display met Bluetooth &amp; ANT+ verbindingsmogelijkheden,"Praxis, 50/34T, 12-speed","https://media.trekbikes.com/image/upload/c_pad,w_1360,h_1020,f_jpg,fl_progressive:semi,q_auto,fl_strip_profile/DomanePlusSLR9-25-36742-B-primary",images/Trek/Domane_SLR_7/DomanePlusSLR9-25-36742-B-primary_01.jpg,"https://media.trekbikes.com/image/upload/c_pad,w_1360,h_1020,f_jpg,fl_progressive:semi,q_auto,fl_strip_profile/DomanePlusSLR7eTapUS-24-41482-C-Primary",images/Trek/Domane_SLR_7/DomanePlusSLR7eTapUS-24-41482-C-Primary_02.jpg,"https://media.trekbikes.com/image/upload/c_pad,w_1360,h_1020,f_jpg,fl_progressive:semi,q_auto,fl_strip_profile/DOMANEPLUSSLR8AXSUS-25-49165-B-Primary",images/Trek/Domane_SLR_7/DOMANEPLUSSLR8AXSUS-25-49165-B-Primary_03.jpg,"https://media.trekbikes.com/image/upload/c_pad,w_1360,h_1020,f_jpg,fl_progressive:semi,q_auto,fl_strip_profile/DomanePlusSLR6_23_36701_A_Primary",images/Trek/Domane_SLR_7/DomanePlusSLR6_23_36701_A_Primary_04.jpg,"https://media.trekbikes.com/image/upload/c_pad,w_1360,h_1020,f_jpg,fl_progressive:semi,q_auto,fl_strip_profile/DomanePlusSLR9_23_36742_C_Primary",images/Trek/Domane_SLR_7/DomanePlusSLR9_23_36742_C_Primary_05.jpg,2025-07-18 09:56:56,trek_scraper
