Madone SL 5 Gen 8,,publish,product,46218,3099.0,Performance road bikes,Trek,https://www.trekbikes.com/nl/nl_NL/p/46218/,blue,Blue,500 Series Oclv Carbon,H1.5 Race*,ML - 8.70 kg (met binnenbanden),125 kg,Shimano 105 R7120,"Shimano 105 R7100, aanlasnok, down swing","Shimano 105 R7100, max. tandwielgrootte 36T","Maat: XS, S Shimano 105 R7100, 50/34, 165 mm lengte","Praxis, T47 met schroefdraad, interne lagers","Shimano 105 7101, 11-34, 12-speed","Shimano SLX M7100, 12-speed",,"1x: 54T, 2x: 56/43","Bontrager lichtmetaal, afgedichte lagers, centerlock disc, 100 x 12 mm steekas","Bontrager Switch afgeschuinde steekas, afneembare hendel",,"Bontrager Paradigm SL, Tubeless Ready, 24-gaats, 21 mm velgbreedte, Presta-ventiel","Bontrager R1 Hard-Case Lite, stalen hieldraad, 60 tpi, 700 x 28 mm","32 mm (feitelijk gemeten, bekijk de handleiding voor details)","Maat: XS, S Bontrager Aeolus Comp, stalen rails, 155 mm breedte","Maat: XS, S, M, XL Madone aero carbon zadelpen, 0 mm offset, korte versie","Maat: XS Bontrager Comp, lichtmetaal, 31,8 mm, 80 mm reach, 121 mm drop, 36 cm breedte bij hendels, 40 cm breedte onderin stuurbeugel",,"Maat: XS Trek RCS Pro, -7 graden, 80 mm lengte",,,12-speed,"Madone Gen 8 full carbon, tapered carbon steerer, internal brake routing, flat mount disc, 12x100mm chamfered thru axle","Maat: XS, S, M, ML, L, XL Bontrager Switch gegroefde steekas, afneembare hendel","14g roestvast staal, zwart","Shimano RT70, centerlock, 160 mm","Maximale maat remschijven: 180 mm voor, 160 mm achter",,,,,,"Bontrager Paradigm SL, Tubeless Ready, 21 mm velgbreedte, 100 x 12 mm steekas",,,,,,,,,,,,,,"https://media.trekbikes.com/image/upload/c_pad,w_1360,h_1020,f_jpg,fl_progressive:semi,q_auto,fl_strip_profile/MadoneSL7-25-46220-A-Primary",images/Trek/Madone_SL_5_Gen_8/MadoneSL7-25-46220-A-Primary_01.jpg,"https://media.trekbikes.com/image/upload/c_pad,w_1360,h_1020,f_jpg,fl_progressive:semi,q_auto,fl_strip_profile/MadoneSL6AXS-25-46221-A-Primary",images/Trek/Madone_SL_5_Gen_8/MadoneSL6AXS-25-46221-A-Primary_02.jpg,"https://media.trekbikes.com/image/upload/c_pad,w_1360,h_1020,f_jpg,fl_progressive:semi,q_auto,fl_strip_profile/MadoneSL6-25-46219-C-Primary",images/Trek/Madone_SL_5_Gen_8/MadoneSL6-25-46219-C-Primary_03.jpg,"https://media.trekbikes.com/image/upload/c_pad,w_1360,h_1020,f_jpg,fl_progressive:semi,q_auto,fl_strip_profile/MadoneSL7-24-41467-A-Primary",images/Trek/Madone_SL_5_Gen_8/MadoneSL7-24-41467-A-Primary_04.jpg,"https://media.trekbikes.com/image/upload/c_pad,w_1360,h_1020,f_jpg,fl_progressive:semi,q_auto,fl_strip_profile/MadoneSL7-26-57664-A-Primary",images/Trek/Madone_SL_5_Gen_8/MadoneSL7-26-57664-A-Primary_05.jpg,2025-07-18 09:56:56,trek_scraper
Checkpoint SL 5 AXS Gen 3,,publish,product,47071,3499.0,Checkpoint,Trek,https://www.trekbikes.com/nl/nl_NL/p/47071/,black_grey,Black/Grey,500 Series Oclv Carbon,Endurance*,"ML- 9,50 kg (met TLR dichtmiddel, zonder binnenbanden)",125 kg,,"1x, geen voorderailleur","SRAM Apex XPLR eTap AXS, max. tandwielgrootte 44T","Maat: XS, S SRAM Apex 1, 40T, DUB Wide, 165 mm lengte","SRAM DUB Wide, T47 met schroefdraad, interne lagers","SRAM XPLR PG-1231, 11-44, 12-speed","SRAM Apex, 12-speed",,1x:44 2x: 46/30,"Bontrager lichtmetaal, afgedichte lagers, centerlock disc, 100 x 12 mm steekas","Bontrager Switch afgeschuinde steekas, afneembare hendel","Bontrager lichtmetaal, afgedichte lagers, centerlock disc, Shimano 11-speed freewheelbody, 142 x 12 mm steekas","Maat: XS, S, M, ML, L, XL Bontrager Paradigm SL, Tubeless Ready, 24-gaats, 21 mm velgbreedte, Presta-ventiel","Bontrager Girona RSL, Tubeless Ready, GR-lekbescherming, aramide hieldraad, 220 tpi, 700 x 42 mm","50 mm zonder spatborden, 42 mm met spatborden (feitelijk gemeten, bekijk de handleiding voor details)","Maat: XS, S Verse Short Comp, stalen rails, 155 mm breedte","Bontrager carbon, 27,2 mm, 8 mm offset, 330 mm lengte","Maat: XS Bontrager Elite Gravel, lichtmetaal, 40 cm breedte",Bontrager Supertack geperforeerd stuurlint,"Maat: XS Bontrager Elite, 31,8 mm, geschikt voor Blendr, 7 graden, 60 mm lengte",,,,"Checkpoint full carbon, taps toelopende carbon stuurbuis, spatbordbevestigingen, drievoudige dragerophanging, flat-mount schijfrem, 12 x 100 mm afgeschuinde steekas","Maat: XS, S, M, ML, L, XL Bontrager Switch afgeschuinde steekas, afneembare hendel","14g roestvast staal, zwart","SRAM Paceline, afgerond, centerlock, 160 mm",Maximale diameter remschijven: 180 mm voor en achter,"Bontrager TLR-dichtmiddel, 175 ml",Bontrager TLR,,,,"Bontrager Paradigm SL, Tubeless Ready, 21 mm velgbreedte, 100 x 12 mm steekas",,,SRAM eTap accu (met lader),,,40 mm (XS: alleen geschikt voor een starre voorvork) In de veelgestelde vragen over de Checkpoint SL Gen 3 vind je de passende opties,,,,,,,,"https://media.trekbikes.com/image/upload/c_pad,w_1360,h_1020,f_jpg,fl_progressive:semi,q_auto,fl_strip_profile/CheckpointSL7AXS-26-55097-A-Primary",images/Trek/Checkpoint_SL_5_AXS_Gen_3/CheckpointSL7AXS-26-55097-A-Primary_01.jpg,"https://media.trekbikes.com/image/upload/c_pad,w_1360,h_1020,f_jpg,fl_progressive:semi,q_auto,fl_strip_profile/CheckpointSL6AXS-26-55098-B-Primary",images/Trek/Checkpoint_SL_5_AXS_Gen_3/CheckpointSL6AXS-26-55098-B-Primary_02.jpg,"https://media.trekbikes.com/image/upload/c_pad,w_1360,h_1020,f_jpg,fl_progressive:semi,q_auto,fl_strip_profile/CheckpointSLFrameset-25-46765-A-Primary",images/Trek/Checkpoint_SL_5_AXS_Gen_3/CheckpointSLFrameset-25-46765-A-Primary_03.jpg,"https://media.trekbikes.com/image/upload/c_pad,w_1360,h_1020,f_jpg,fl_progressive:semi,q_auto,fl_strip_profile/CheckpointSL6eTap-24-41397-B-Primary",images/Trek/Checkpoint_SL_5_AXS_Gen_3/CheckpointSL6eTap-24-41397-B-Primary_04.jpg,"https://media.trekbikes.com/image/upload/c_pad,w_1360,h_1020,f_jpg,fl_progressive:semi,q_auto,fl_strip_profile/CheckpointSL5-24-41398-B-Primary",images/Trek/Checkpoint_SL_5_AXS_Gen_3/CheckpointSL5-24-41398-B-Primary_05.jpg,2025-07-18 09:56:56,trek_scraper
Boone 5,,publish,product,41655,3499.0,Cyclocross bikes,Trek,https://www.trekbikes.com/nl/nl_NL/p/41655/,greylight,Grey light,600 Series Oclv Carbon,H1.5 Race*,"56 cm - 8,50 kg",125 kg,SRAM Apex,"1x, geen voorderailleur","SRAM Apex XPLR, max. tandwielgrootte 44T","Maat: 49 SRAM Apex 1, 40T, DUB Wide, 165 mm lengte","SRAM DUB Wide, T47 met schroefdraad, interne lagers","SRAM XPLR PG-1231, 11-44, 12-speed","SRAM Apex, 12-speed",,Bekijk de servicehandleiding,,"Bontrager Switch steekas, afneembare hendel",,,"Bontrager CX3 Team Issue, aramide hieldraad, 120 tpi, 700 x 32 mm",38 mm,"Maat: 49, 52 Verse Short Comp, stalen rails, 155 mm breedte","Maat: 49, 52, 54, 56 Bontrager carbon seatmast cap, 5 mm offset, korte versie","Maat: 49 Bontrager Elite IsoZone VR-CF, lichtmetaal, 31,8 mm, 93 mm reach, 123 mm drop, 38 cm breedte",Bontrager Supertack geperforeerd stuurlint,"Maat: 49 Bontrager Pro, 31,8 mm, geschikt voor Blendr, 7 graden, 80 mm lengte",,"SRAM Apex hydraulische schijfrem, flat-mount",12-speed,"Trek Cross, full carbon, taps toelopende carbon stuurbuis, flat-mount schijfrem, 12 x 100 mm steekas","Bontrager Switch steekas, afneembare hendel",,"SRAM Paceline, afgerond, centerlock, 160 mm",Maximale maat remschijven: 160 mm voor en achter,,,,"SRAM Apex, 12-speed",,"Bontrager Paradigm Comp 25, Tubeless Ready, 25 mm velgbreedte, 100 x 12 mm steekas","Bontrager Paradigm Comp 25, Tubeless Ready, 25 mm velgbreedte, Shimano 11/12-speed freewheelnaaf, 142 x 12 mm steekas",,,,,,,,,,,,,"https://media.trekbikes.com/image/upload/c_pad,w_1360,h_1020,f_jpg,fl_progressive:semi,q_auto,fl_strip_profile/BooneDiscFrameset-25-47997-A-Primary",images/Trek/Boone_5/BooneDiscFrameset-25-47997-A-Primary_01.jpg,"https://media.trekbikes.com/image/upload/c_pad,w_1360,h_1020,f_jpg,fl_progressive:semi,q_auto,fl_strip_profile/BooneDiscFrameset_22_35696_B_Primary",images/Trek/Boone_5/BooneDiscFrameset_22_35696_B_Primary_02.jpg,"https://media.trekbikes.com/image/upload/c_pad,w_1360,h_1020,f_jpg,fl_progressive:semi,q_auto,fl_strip_profile/BooneDiscFrameset-25-47997-B-Primary",images/Trek/Boone_5/BooneDiscFrameset-25-47997-B-Primary_03.jpg,"https://media.trekbikes.com/image/upload/c_pad,w_1360,h_1020,f_jpg,fl_progressive:semi,q_auto,fl_strip_profile/BooneDiscFrameset_22_35696_A_Primary",images/Trek/Boone_5/BooneDiscFrameset_22_35696_A_Primary_04.jpg,https://media.trekbikes.com/image/upload/w_1200/Boone5-24-41655-A-Portrait,images/Trek/Boone_5/Boone5-24-41655-A-Portrait_05.jpg,2025-07-18 09:56:56,trek_scraper
Checkpoint SL 5 Gen 2,,publish,product,41398,3699.0,Checkpoint,Trek,https://www.trekbikes.com/nl/nl_NL/p/41398/,orange,Orange,500 Series Oclv Carbon,Endurance*,"56 cm - 9,76 kg (met TLR dichtmiddel, zonder binnenbanden)",125 kg,Shimano GRX RX610,"Shimano GRX RX820, aanlasnok, down swing","Shimano GRX RX820, max. tandwielgrootte 36T","Maat: 49 Shimano GRX RX610, 46/30, 165 mm lengte","Praxis, T47 met schroefdraad, interne lagers","Shimano 105 7100, 11-36, 12-speed","Shimano SLX M7100, 12-speed",,"1x: 46T, 2x: 50/37","Bontrager lichtmetaal, afgedichte lagers, centerlock disc, 100 x 12 mm steekas","Bontrager Switch steekas, afneembare hendel","Bontrager lichtmetaal, afgedichte lagers, centerlock disc, Shimano 11-speed freewheelbody, 142 x 12 mm steekas","Bontrager Paradigm SL, Tubeless Ready, 24-gaats, 21 mm velgbreedte, Presta-ventiel","Bontrager GR1 Team Issue, Tubeless Ready, Inner Strength karkas, aramide hieldraad, 120 tpi, 700 x 40 mm",Bekijk de servicehandleiding,"Maat: 49, 52 Bontrager Verse Comp, stalen rails, 155 mm breedte","Bontrager carbon, 27,2 mm, 8 mm offset, 330 mm lengte","Maat: 49 Bontrager Elite Gravel, lichtmetaal, 38 cm breedte",Bontrager Supertack geperforeerd stuurlint,"Maat: 49 Bontrager Elite, 31,8 mm, geschikt voor Blendr, 7 graden, 70 mm lengte",,"Shimano RX410 hydraulische schijfrem, flat-mount",12-speed,"Trek Checkpoint, full carbon, tapered carbon steerer, rack mounts, fender mounts, flat mount disc, 12x100mm thru axle","Bontrager Switch steekas, afneembare hendel","14g roestvast staal, zwart","Shimano RT70, centerlock, 160 mm",Maximale maat remschijven: 160 mm voor en achter,"Bontrager TLR-dichtmiddel, 175 ml",Bontrager TLR,,,,"Bontrager Paradigm SL, Tubeless Ready, 21 mm velgbreedte, 100 x 12 mm steekas","Bontrager Paradigm SL, Tubeless Ready, 21 mm velgbreedte, 142 x 12 mm steekas",Bontrager BITS Internal Frame opbergtas,,,,,,,,,,,,"https://media.trekbikes.com/image/upload/c_pad,w_1360,h_1020,f_jpg,fl_progressive:semi,q_auto,fl_strip_profile/CheckpointSL7AXS-26-55097-A-Primary",images/Trek/Checkpoint_SL_5_Gen_2/CheckpointSL7AXS-26-55097-A-Primary_01.jpg,"https://media.trekbikes.com/image/upload/c_pad,w_1360,h_1020,f_jpg,fl_progressive:semi,q_auto,fl_strip_profile/CheckpointSL6AXS-26-55098-B-Primary",images/Trek/Checkpoint_SL_5_Gen_2/CheckpointSL6AXS-26-55098-B-Primary_02.jpg,"https://media.trekbikes.com/image/upload/c_pad,w_1360,h_1020,f_jpg,fl_progressive:semi,q_auto,fl_strip_profile/CheckpointSL5AXS-26-47071-B-Primary",images/Trek/Checkpoint_SL_5_Gen_2/CheckpointSL5AXS-26-47071-B-Primary_03.jpg,"https://media.trekbikes.com/image/upload/c_pad,w_1360,h_1020,f_jpg,fl_progressive:semi,q_auto,fl_strip_profile/CheckpointSLFrameset-25-46765-A-Primary",images/Trek/Checkpoint_SL_5_Gen_2/CheckpointSLFrameset-25-46765-A-Primary_04.jpg,"https://media.trekbikes.com/image/upload/c_pad,w_1360,h_1020,f_jpg,fl_progressive:semi,q_auto,fl_strip_profile/CheckpointSL6eTap-24-41397-B-Primary",images/Trek/Checkpoint_SL_5_Gen_2/CheckpointSL6eTap-24-41397-B-Primary_05.jpg,2025-07-18 09:56:56,trek_scraper
Checkpoint SL 6 AXS Gen 3,,publish,product,55098,3999.0,Checkpoint,Trek,https://www.trekbikes.com/nl/nl_NL/p/55098/,greendark,Green dark,500 Series Oclv Carbon,Endurance*,,125 kg,,"1x, geen voorderailleur","SRAM Rival XPLR AXS, max. tandwielgrootte 46T",,"SRAM DUB, T47 met schroefdraad, interne lagers*","SRAM Rival XPLR XG-1351, 10-46, 13-speed","SRAM Rival, 13-speed*",,1x:44 2x: 46/30,,"Bontrager Switch afgeschuinde steekas, afneembare hendel",,,"Bontrager Girona Pro, Tubeless Ready, GR-lekbescherming, aramide hieldraad, 60 tpi, 700 x 42 mm","50 mm zonder spatborden, 42 mm met spatborden (feitelijk gemeten, bekijk de handleiding voor details)","Verse Short Comp, stalen rails, 145 mm breedte","Bontrager carbon, 27,2 mm, 8 mm offset, 330 mm lengte","Maat: XS, S Bontrager Elite Gravel, lichtmetaal, 40 cm breedte",Bontrager Supertack Perf tape,"Maat: XS Bontrager Pro, 31,8 mm, geschikt voor Blendr, 7 graden, 70 mm lengte",,,,,"Bontrager Switch afgeschuinde steekas, afneembare hendel",,,Maximale maten remschijf: 180 mm vooraan en achteraan,"Bontrager TLR-dichtmiddel, 175 ml",Bontrager TLR,,,,"Bontrager Paradigm Comp 25, Tubeless Ready, 25 mm velgbreedte, 100 x 12 mm steekas","Bontrager Paradigm Comp 25, Tubeless Ready, 25mm rim width, SRAM XD-R 12-speed freehub, 142x12 thru axle",,SRAM eTap accu (met lader),,,40 mm (XS: alleen geschikt voor een starre voorvork) In de veelgestelde vragen over de Checkpoint SL Gen 3 vind je de passende opties,,,,,,,,"https://media.trekbikes.com/image/upload/c_pad,w_1360,h_1020,f_jpg,fl_progressive:semi,q_auto,fl_strip_profile/CheckpointSL7AXS-26-55097-A-Primary",images/Trek/Checkpoint_SL_6_AXS_Gen_3/CheckpointSL7AXS-26-55097-A-Primary_01.jpg,"https://media.trekbikes.com/image/upload/c_pad,w_1360,h_1020,f_jpg,fl_progressive:semi,q_auto,fl_strip_profile/CheckpointSL5AXS-26-47071-B-Primary",images/Trek/Checkpoint_SL_6_AXS_Gen_3/CheckpointSL5AXS-26-47071-B-Primary_02.jpg,"https://media.trekbikes.com/image/upload/c_pad,w_1360,h_1020,f_jpg,fl_progressive:semi,q_auto,fl_strip_profile/CheckpointSLFrameset-25-46765-A-Primary",images/Trek/Checkpoint_SL_6_AXS_Gen_3/CheckpointSLFrameset-25-46765-A-Primary_03.jpg,"https://media.trekbikes.com/image/upload/c_pad,w_1360,h_1020,f_jpg,fl_progressive:semi,q_auto,fl_strip_profile/CheckpointSL6eTap-24-41397-B-Primary",images/Trek/Checkpoint_SL_6_AXS_Gen_3/CheckpointSL6eTap-24-41397-B-Primary_04.jpg,"https://media.trekbikes.com/image/upload/c_pad,w_1360,h_1020,f_jpg,fl_progressive:semi,q_auto,fl_strip_profile/CheckpointSL5-24-41398-B-Primary",images/Trek/Checkpoint_SL_6_AXS_Gen_3/CheckpointSL5-24-41398-B-Primary_05.jpg,2025-07-18 09:56:56,trek_scraper
Domane SL 6 gen 4,,publish,product,47131,4299.0,Performance road bikes,Trek,https://www.trekbikes.com/nl/nl_NL/p/47131/,bluedark,Blue dark,500 Series Oclv Carbon,Endurance*,"56 cm - 8.90 kg (met TLR sealant, zonder binnenbanden)",125 kg,Shimano 105 R7170,"Shimano 105 R7150 Di2, aanlasnok, down-swing","Shimano 105 R7150 Di2, max. tandwielgrootte 36T","Maat: 44, 47 Shimano 105 R7100, 50/34, 165 mm lengte","Praxis, T47 met schroefdraad, interne lagers","Shimano 105 7101, 11-34, 12-speed","Shimano SLX M7100, 12-speed",,"1x: 48T, 2x: 52/36",,"Bontrager Switch steekas, afneembare hendel",,,"Bontrager R3 Hard-Case Lite, Tubeless Ready, aramide hieldraad, 120 tpi, 700 x 32 mm","38mm zonder spatborden, 35mm met spatborden","Maat: 44, 47, 50, 52 Verse Short Comp, stalen rails, 155 mm breedte","Maat: 44, 47, 50, 52, 54, 56 KVF aero carbon zadelpen, 20 mm offset, 280 mm lengte","Maat: 44, 47 Bontrager Elite IsoZone VR-SF, lichtmetaal, 31,8 mm, interne Di2-kabelgeleiding, 75 mm reach, 128 mm drop, 36 cm breedte",Bontrager Supertack geperforeerd stuurlint,"Maat: 44 Trek RCS Pro, -7 graden, 60 mm lengte",,,12-speed,"Domane SL carbon, taps toelopende carbon stuurbuis, interne remkabelgeleiding, spatbordbevestigingen, flat-mount schijfrembevestiging, 12 x 100 mm steekas","Bontrager Switch steekas, afneembare hendel",,"Shimano RT70, centerlock, 160 mm",Maximale maat remschijven: 160 mm voor en achter,"Bontrager TLR-dichtmiddel, 175 ml",Bontrager TLR,,,,"Bontrager Paradigm Comp 25, Tubeless Ready, 25 mm velgbreedte, 100 x 12 mm steekas","Bontrager Paradigm Comp 25, Tubeless Ready, 25 mm velgbreedte, Shimano 11/12-speed freewheelnaaf, 142 x 12 mm steekas",,,,,,,,,,,,,"https://media.trekbikes.com/image/upload/c_pad,w_1360,h_1020,f_jpg,fl_progressive:semi,q_auto,fl_strip_profile/DomaneSLFrameset_23_37302_B_Primary",images/Trek/Domane_SL_6_gen_4/DomaneSLFrameset_23_37302_B_Primary_01.jpg,"https://media.trekbikes.com/image/upload/c_pad,w_1360,h_1020,f_jpg,fl_progressive:semi,q_auto,fl_strip_profile/DomaneSL5-24-41348-C-Primary",images/Trek/Domane_SL_6_gen_4/DomaneSL5-24-41348-C-Primary_02.jpg,"https://media.trekbikes.com/image/upload/c_pad,w_1360,h_1020,f_jpg,fl_progressive:semi,q_auto,fl_strip_profile/DomaneSL7-25-47132-A-Primary",images/Trek/Domane_SL_6_gen_4/DomaneSL7-25-47132-A-Primary_03.jpg,"https://media.trekbikes.com/image/upload/c_pad,w_1360,h_1020,f_jpg,fl_progressive:semi,q_auto,fl_strip_profile/DomaneSLFS_19_23396_A_Primary",images/Trek/Domane_SL_6_gen_4/DomaneSLFS_19_23396_A_Primary_04.jpg,"https://media.trekbikes.com/image/upload/c_pad,w_1360,h_1020,f_jpg,fl_progressive:semi,q_auto,fl_strip_profile/DomaneSL6eTap_23_36152_B_Primary",images/Trek/Domane_SL_6_gen_4/DomaneSL6eTap_23_36152_B_Primary_05.jpg,2025-07-18 09:56:56,trek_scraper
Madone SL 6 AXS Gen 8,,publish,product,46221,4299.0,Performance road bikes,Trek,https://www.trekbikes.com/nl/nl_NL/p/46221/,black,Black,500 Series Oclv Carbon,H1.5 Race*,"ML - 8.43 kg (met TLR sealant, zonder binnenbanden)",125 kg,SRAM Rival eTap AXS,"SRAM Rival D1 AXS, aanlasnok",SRAM Rival AXS,"Maat: XS, S SRAM Rival AXS met vermogensmeter, 48/35, DUB, 165 mm lengte","SRAM DUB, T47 met schroefdraad, interne lagers","SRAM XG-1250, 10-36, 12-speed","SRAM Rival, 12-speed*",,"1x: 54T, 2x: 56/43","Bontrager lichtmetaal, afgedichte lagers, centerlock disc, 100 x 12 mm steekas","Bontrager Switch afgeschuinde steekas, afneembare hendel",,"Bontrager Aeolus Elite 35, OCLV Carbon, Tubeless Ready, 35mm rim depth, 100x12mm thru axle","Bontrager R3 Hard-Case Lite, Tubeless Ready, aramide hieldraad, 170 tpi, 700 x 28 mm","32 mm (feitelijk gemeten, bekijk de handleiding voor details)","Maat: XS, S Bontrager Aeolus Comp, stalen rails, 155 mm breedte","Maat: XS, S, M, XL Madone aero carbon zadelpen, 0 mm offset, korte versie","Maat: XS Bontrager Comp, lichtmetaal, 31,8 mm, 80 mm reach, 121 mm drop, 36 cm breedte bij hendels, 40 cm breedte onderin stuurbeugel",,"Maat: XS Trek RCS Pro, -7 graden, 80 mm lengte",,,12-speed,"Madone Gen 8 full carbon, tapered carbon steerer, internal brake routing, flat mount disc, 12x100mm chamfered thru axle","Bontrager Switch afgeschuinde steekas, afneembare hendel",,"SRAM Paceline, afgerond, centerlock, 160 mm","Maximale maat remschijven: 180 mm voor, 160 mm achter",,Bontrager TLR,,,,"Bontrager Aeolus Elite 35, OCLV Carbon, Tubeless Ready, 35 mm velghoogte, 100 x 12 mm steekas","Bontrager Aeolus Elite 35, OCLV Carbon, Tubeless Ready, SRAM XD-R freewheelbody, 142 x 12 mm steekas",,SRAM eTap accu (met lader),,,,,,,,,,,"https://media.trekbikes.com/image/upload/c_pad,w_1360,h_1020,f_jpg,fl_progressive:semi,q_auto,fl_strip_profile/MadoneSL7-25-46220-A-Primary",images/Trek/Madone_SL_6_AXS_Gen_8/MadoneSL7-25-46220-A-Primary_01.jpg,"https://media.trekbikes.com/image/upload/c_pad,w_1360,h_1020,f_jpg,fl_progressive:semi,q_auto,fl_strip_profile/MadoneSL5-25-46218-A-Primary",images/Trek/Madone_SL_6_AXS_Gen_8/MadoneSL5-25-46218-A-Primary_02.jpg,"https://media.trekbikes.com/image/upload/c_pad,w_1360,h_1020,f_jpg,fl_progressive:semi,q_auto,fl_strip_profile/MadoneSL6-25-46219-C-Primary",images/Trek/Madone_SL_6_AXS_Gen_8/MadoneSL6-25-46219-C-Primary_03.jpg,"https://media.trekbikes.com/image/upload/c_pad,w_1360,h_1020,f_jpg,fl_progressive:semi,q_auto,fl_strip_profile/MadoneSL7-24-41467-A-Primary",images/Trek/Madone_SL_6_AXS_Gen_8/MadoneSL7-24-41467-A-Primary_04.jpg,"https://media.trekbikes.com/image/upload/c_pad,w_1360,h_1020,f_jpg,fl_progressive:semi,q_auto,fl_strip_profile/MadoneSL6-24-41466-A-Primary",images/Trek/Madone_SL_6_AXS_Gen_8/MadoneSL6-24-41466-A-Primary_05.jpg,2025-07-18 09:56:56,trek_scraper
Émonda SL 6,,publish,product,41352,4499.0,Performance road bikes,Trek,https://www.trekbikes.com/nl/nl_NL/p/41352/,greylight_purple,Grey light/Purple,500 Series Oclv Carbon,H1.5 Race*,"56 cm - 8,50 kg",125 kg,Shimano 105 R7170,"Shimano 105 R7150 Di2, aanlasnok, down-swing","Shimano 105 R7150 Di2, max. tandwielgrootte 36T","Maat: 47 Shimano 105 R7100, 50/34, 165 mm lengte","Praxis, T47 met schroefdraad, interne lagers","Shimano 105 7101, 11-34, 12-speed","Shimano SLX M7100, 12-speed",,"1x: 50T, 2x: 53/39","Bontrager lichtmetaal, afgedichte lagers, centerlock disc, 100 x 12 mm steekas","Bontrager Switch steekas, afneembare hendel",,"Bontrager Aeolus Elite 35, OCLV Carbon, Tubeless Ready, 35mm rim depth, 100x12mm thru axle","Bontrager R2 Hard-Case Lite, aramide hieldraad, 60 tpi, 700 x 28 mm",28 mm,"Maat: 47, 50, 52 Bontrager Aeolus Comp, stalen rails, 155 mm breedte","Maat: 47, 50, 52, 54 Bontrager carbon seatmast cap, 20 mm offset, korte versie","Maat: 47, 50 Bontrager Elite VR-C, lichtmetaal, 31,8 mm, 100 mm reach, 124 mm drop, 38 cm breedte",Bontrager Supertack geperforeerd stuurlint,"Maat: 47 Trek RCS Pro, -7 graden, 70 mm lengte",,"Shimano 105 hydraulische schijfrem, flat-mount",12-speed,"Émonda SL full carbon, taps toelopende carbon stuurbuis, interne remkabelgeleiding, Flat-Mount schijfrem, 12 x 100 mm steekas","Bontrager Switch steekas, afneembare hendel",,"Shimano RT70, centerlock, 160 mm",Maximale maat remschijven: 160 mm voor en achter,,,,,,"Bontrager Aeolus Elite 35, OCLV Carbon, Tubeless Ready, 35 mm velghoogte, 100 x 12 mm steekas","Bontrager Aeolus Elite 35, OCLV Carbon, Tubeless Ready, 35 mm velghoogte, Shimano 11/12-speed freewheelnaaf, 142 x 12 mm steekas",,Shimano BT-DN300,Inclusief laadkabel,,,,,,,,,,"https://media.trekbikes.com/image/upload/c_pad,w_1360,h_1020,f_jpg,fl_progressive:semi,q_auto,fl_strip_profile/EmondaSLFS_19_24014_A_Primary",images/Trek/Émonda_SL_6/EmondaSLFS_19_24014_A_Primary_01.jpg,"https://media.trekbikes.com/image/upload/c_pad,w_1360,h_1020,f_jpg,fl_progressive:semi,q_auto,fl_strip_profile/EmondaSL7_22_35046_A_Primary",images/Trek/Émonda_SL_6/EmondaSL7_22_35046_A_Primary_02.jpg,"https://media.trekbikes.com/image/upload/c_pad,w_1360,h_1020,f_jpg,fl_progressive:semi,q_auto,fl_strip_profile/EmondaSL5_23_36974_A_Primary",images/Trek/Émonda_SL_6/EmondaSL5_23_36974_A_Primary_03.jpg,"https://media.trekbikes.com/image/upload/c_pad,w_1360,h_1020,f_jpg,fl_progressive:semi,q_auto,fl_strip_profile/EmondaSLDiscFrameset_21_32688_A_Primary",images/Trek/Émonda_SL_6/EmondaSLDiscFrameset_21_32688_A_Primary_04.jpg,https://media.trekbikes.com/image/upload/w_1200/EmondaSL6-24-41352-A-Portrait,images/Trek/Émonda_SL_6/EmondaSL6-24-41352-A-Portrait_05.jpg,2025-07-18 09:56:56,trek_scraper
Checkpoint SL 6 AXS Gen 2,,publish,product,41397,4599.0,Checkpoint,Trek,https://www.trekbikes.com/nl/nl_NL/p/41397/,greenlight,Green light,500 Series Oclv Carbon,Endurance*,"56 cm - 9,35 kg (met TLR dichtmiddel, zonder binnenbanden)",125 kg,SRAM Rival eTap AXS,"1x, geen voorderailleur","SRAM Rival XPLR eTap AXS, max. tandwielgrootte 44T","Maat: 49 SRAM Rival, 40T, DUB Wide, 165 mm lengte","SRAM DUB Wide, T47 met schroefdraad, interne lagers","SRAM XG-1251, 10-44, 12-speed","SRAM Rival, 12 speed",,"1x: 46T, 2x: 50/37",,"Bontrager Switch steekas, afneembare hendel",,,"Bontrager GR1 Team Issue, Tubeless Ready, Inner Strength karkas, aramide hieldraad, 120 tpi, 700 x 40 mm",Bekijk de servicehandleiding,"Maat: 49, 52 Bontrager Verse Comp, stalen rails, 155 mm breedte","Bontrager carbon, 27,2 mm, 8 mm offset, 330 mm lengte","Maat: 49 Bontrager Elite Gravel, lichtmetaal, 38 cm breedte",Bontrager Supertack geperforeerd stuurlint,"Maat: 49 Bontrager Pro, 31,8 mm, geschikt voor Blendr, 7 graden, 70 mm lengte",,"SRAM Rival hydraulische schijfrem, flat-mount",12-speed,"Trek Checkpoint, full carbon, tapered carbon steerer, rack mounts, fender mounts, flat mount disc, 12x100mm thru axle","Bontrager Switch steekas, afneembare hendel",,"SRAM Paceline, afgerond, centerlock, 160 mm",Maximale maat remschijven: 160 mm voor en achter,"Bontrager TLR-dichtmiddel, 175 ml",Bontrager TLR,,,,"Bontrager Paradigm Comp 25, Tubeless Ready, 25 mm velgbreedte, 100 x 12 mm steekas","Bontrager Paradigm Comp 25, Tubeless Ready, 25 mm velgbreedte, SRAM XD-R 12-speed freewheelnaaf, 142 x 12 mm steekas",Bontrager BITS Internal Frame opbergtas,SRAM eTap accu (met lader),,,,,,,,,,,"https://media.trekbikes.com/image/upload/c_pad,w_1360,h_1020,f_jpg,fl_progressive:semi,q_auto,fl_strip_profile/CheckpointSL7AXS-26-55097-A-Primary",images/Trek/Checkpoint_SL_6_AXS_Gen_2/CheckpointSL7AXS-26-55097-A-Primary_01.jpg,"https://media.trekbikes.com/image/upload/c_pad,w_1360,h_1020,f_jpg,fl_progressive:semi,q_auto,fl_strip_profile/CheckpointSL6AXS-26-55098-B-Primary",images/Trek/Checkpoint_SL_6_AXS_Gen_2/CheckpointSL6AXS-26-55098-B-Primary_02.jpg,"https://media.trekbikes.com/image/upload/c_pad,w_1360,h_1020,f_jpg,fl_progressive:semi,q_auto,fl_strip_profile/CheckpointSL5AXS-26-47071-B-Primary",images/Trek/Checkpoint_SL_6_AXS_Gen_2/CheckpointSL5AXS-26-47071-B-Primary_03.jpg,"https://media.trekbikes.com/image/upload/c_pad,w_1360,h_1020,f_jpg,fl_progressive:semi,q_auto,fl_strip_profile/CheckpointSLFrameset-25-46765-A-Primary",images/Trek/Checkpoint_SL_6_AXS_Gen_2/CheckpointSLFrameset-25-46765-A-Primary_04.jpg,"https://media.trekbikes.com/image/upload/c_pad,w_1360,h_1020,f_jpg,fl_progressive:semi,q_auto,fl_strip_profile/CheckpointSL5-24-41398-B-Primary",images/Trek/Checkpoint_SL_6_AXS_Gen_2/CheckpointSL5-24-41398-B-Primary_05.jpg,2025-07-18 09:56:56,trek_scraper
